{
    "heroTone": "ink",
    "storyEyebrow": "Medical program",
    "storySummary": "Clinical detail with indications, audience, cautions, duration, and pricing consistent with checkout.",
    "storyTone": "porcelain",
    "evidenceEyebrow": "Fit and evidence",
    "evidenceTitle": "What usually indicates fit, what requires caution, and how the next step should be read.",
    "evidenceTone": "silver",
    "evidenceFallbackBullets": [
        "Final indication is confirmed in consultation according to skin, goals, and history."
    ],
    "evidenceOutcomes": [
        "Initial clinical read",
        "Expected sequence by treatment type",
        "Escalation to procedure or follow-up when appropriate"
    ],
    "timelineEyebrow": "Care sequence",
    "timelineTone": "ink",
    "timelineSteps": [
        "Assessment and fit confirmation",
        "Preparation and medical briefing",
        "Treatment or follow-up",
        "Results review and continuity"
    ],
    "booking": {
        "eyebrow": "Booking",
        "title": "Book this route with visible pricing, policy, and support.",
        "deck": "Booking keeps service hint, pricing consistency, and operational traceability from availability to payment.",
        "actionLabel": "Book this route",
        "tone": "silver"
    }
}
